{
  "meta": {
    "requestId": "synthetic-request-only",
    "versions": {
      "serviceVersion": "synthetic-fixture-v1",
      "apiVersion": "v1",
      "sajuEngineVersion": "synthetic-fixture-v1",
      "astrologyEngineVersion": "synthetic-fixture-v1",
      "scoreVersion": "synthetic-fixture-v1",
      "configVersion": "synthetic-fixture-v1",
      "locationReferenceVersion": "synthetic-fixture-v1",
      "timezoneDataVersion": "synthetic-fixture-v1",
      "ephemerisProviderVersion": "synthetic-fixture-v1",
      "ephemerisDataVersion": "synthetic-fixture-v1"
    },
    "aiPromptVersion": "AI_PROMPT_V2",
    "provider": "SYNTHETIC_PROVIDER",
    "model": "SYNTHETIC_MODEL",
    "interpretationMode": "AI"
  },
  "summary": "There is not enough evidence for a specific interpretation.",
  "strengths": [
    {
      "text": "This model suggests supportive communication.",
      "evidenceRefs": [
        "ft_c03583aa163c57aaa3462408fda52704fea71c9d64c90385"
      ]
    }
  ],
  "challenges": [],
  "advice": "Communicate openly and respect each other."
}
